Resource Type,Resource Name,Subject/Area,Age Group,Grades,Organizer,Organizer Location,Eligibility,Brief Description,Link to Resource
Contest,American Invitational Mathematics Examination (AIME),Mathematics,13-19,Grades 9-12,Mathematical Association of America (MAA),"Washington, D.C., USA",Open to students scoring in the top 2.5% of AMC 10 or top 5% of AMC 12. Eligible students must be enrolled in schools or homeschools in the US or Canada.,"AIME is an annual mathematics competition offering a rigorous 3-hour exam with integer answers, targeting high-performing students from AMC 10/12 contests. The competition fosters advanced mathematical problem-solving skills. Participation is by invitation, with a pathway to the US Mathematical Olympiad (USAMO).",https://maa.org/student-programs/amc/maa-american-mathematics-competitions-policies/
Scholarship,BC Excellence Scholarships,General,17-18,12,Government of British Columbia,"Victoria, BC","Canadian citizens or permanent residents in B.C., demonstrating leadership and service.","Award amount: $5,000. Recognizes students with leadership, community service, and commitment to career path. Non-renewable.",https://www2.gov.bc.ca/gov/content/education-training/k-12/support/scholarships/provincial-scholarships/bc-excellence-scholarships
Scholarship,BC Achievement Scholarships,General,16-18,10-12,Government of British Columbia,"Victoria, BC",B.C. residents with top academic achievement in grades 10-12.,"Award amount: $1,250. Recognizes top academic performance. Non-renewable.",https://www2.gov.bc.ca/gov/content/education-training/k-12/support/scholarships/provincial-scholarships/bc-achievement-scholarships
Scholarship,Pathway to Teacher Education Scholarship,Education,17-18,12,Government of British Columbia,"Victoria, BC","Students intending to pursue a teaching career, open to B.C. residents.","Award amount: $5,000. Supports students committed to a teaching career. Non-renewable.",https://www2.gov.bc.ca/gov/content/education-training/k-12/support/scholarships/provincial-scholarships/pathway-to-teacher-education-scholarship
Scholarship,UBC Presidential Scholars Award Program,General,17-18,12,University of British Columbia,"Vancouver, BC",Canadian students demonstrating academic excellence and leadership.,"Award ranges from $5,000 to $80,000 over four years. Recognizes academic excellence and leadership.",https://you.ubc.ca/financial-planning/scholarships-awards-canadian-students/presidential-scholars/
Scholarship,SFU Entrance Scholarships,General,17-18,12,Simon Fraser University,"Burnaby, BC",Open to Canadian and international students with high academic achievements.,"Variable amount, up to full tuition. Available to high-achieving students.",https://www.sfu.ca/students/financialaid/entrance.html
Scholarship,UVic Excellence Scholarships,General,18-19,12,University of Victoria,"Victoria, BC, Canada","Canadian citizens, permanent residents, and some international students. Merit and need-based.",Scholarships awarded based on academic excellence. Some awards are renewable.,https://www.uvic.ca/registrar/safa/entrance-scholarships/
Scholarship,KPU Entrance Awards,General,18-19,12,Kwantlen Polytechnic University,"Surrey, BC, Canada",New KPU students. Based on academics and community involvement.,"Major awards include President's Scholarship ($30,000) and merit awards ($7,500). Full-time enrollment required.",https://www.kpu.ca/awards/entrance-scholarship
Scholarship,UBC Centennial Scholars Entrance Award,General,18-19,12,University of British Columbia,"Vancouver, BC, Canada",Domestic students with financial need. Must demonstrate community involvement.,Provides financial assistance to low-income students. Renewable based on performance.,https://you.ubc.ca/financial-planning/scholarships-awards-canadian-students/centennial-scholars/
Financial Aid,SFU Youth in Care Tuition Waiver Program,General,13-19,12,Simon Fraser University,"Burnaby, BC, Canada",Students with foster care experience in BC.,Offers tuition waivers to former foster youth to support education.,https://www.sfu.ca/students/financialaid/entrance/youthcare.html
Scholarship,Surrey Schools Scholarship Program,General,18-19,12,Surrey School District,"Surrey, BC, Canada",Surrey School District graduates with academic and leadership excellence.,Scholarships and bursaries for Surrey students pursuing higher education.,https://www.surreyschools.ca/page/2090/scholarships-bursaries
Scholarship,Vancouver School Board District Scholarships,General,18-19,12,Vancouver School Board,"Vancouver, BC, Canada","Graduating students of VSB. Based on academic, community service, or extracurricular achievements.","Scholarships awarded to VSB graduates excelling in various fields. Includes $1,250 tuition vouchers.",https://www.vsb.bc.ca/student_learning/scholarships_and_awards/Pages/default.aspx
Scholarship,Abbotsford Community Foundation Student Awards,General,18-19,12,Abbotsford Community Foundation,"Abbotsford, BC, Canada","High school graduates from Abbotsford with academic, community involvement, or financial need.",Awards to support students' post-secondary education. Some awards are renewable.,https://abbotsfordcf.org/granting/student-awards-program/
Scholarship/Bursary,Burnaby School District Bursaries,General,18-19,12,Burnaby School District,"Burnaby, BC, Canada",Graduating students from Burnaby schools with academic excellence or leadership.,Bursaries helping Burnaby students pursue higher education based on need or merit.,https://burnabyschools.ca/scholarships-and-bursaries/
Scholarship,Richmond School District Scholarships,General,18-19,12,Richmond School District,"Richmond, BC, Canada",Graduating students from Richmond School District. Consider academics and volunteerism.,Scholarships for Richmond graduates recognizing academic and community achievements.,https://www.sd38.bc.ca/students/scholarships
Contest/Scholarship,Canada-Wide Science Fair Scholarships,STEM,18-19,7-12,Youth Science Canada,Canada,Canadian students participating in regional science fairs.,"Awards and scholarships for science fair participants, with cash prizes and post-secondary opportunities.",https://youthscience.ca/science-fairs/cwsf/awards-and-prizes/
Scholarship,TD Scholarships for Community Leadership,"Leadership, Community Service",17-18 years,12,TD Bank Group,"Toronto, ON, Canada","Canadian students in final year of high school or CEGEP, demonstrating leadership.","Up to $70,000 over four years for tuition and living expenses. Includes paid summer employment and mentorship.",https://www.td.com/ca/en/personal-banking/solutions/student-banking/community-leadership-scholarship-for-canadians/
Scholarship,Loran Scholars Foundation,"Leadership, Community Service, Personal Growth",17-18 years,12,Loran Scholars Foundation,"Etobicoke, ON, Canada",Canadian students in final year of high school or CEGEP with strong leadership and community involvement.,"Leadership award offering up to $100,000 over four years, covering tuition, a stipend, and summer enrichment experiences.",https://loranscholar.ca/becoming-a-scholar/
Scholarship,Schulich Leader Scholarships,"STEM, Engineering, Technology, Science",17-18 years,12,UJA Federation of Greater Toronto,"Toronto, ON, Canada","Students entering undergraduate programs in STEM fields, open to Canadian and Israeli applicants.","Offers up to $100,000 for engineering students and $80,000 for science/math students. Scholarships are awarded annually to 50 high-achievers.",https://schulichleaders.com/
Scholarship,Vancouver Foundation Youth Philanthropy Scholarship,"Community Service, Philanthropy",15-18 years,10-12,Vancouver Foundation,"Vancouver, BC, Canada",Youth actively engaged in community service or volunteering in British Columbia.,Supports youth engaged in philanthropy and community service with grants and scholarships for higher education.,https://www.vancouverfoundation.ca/grants/search-grants
Scholarship,Chinese Benevolent Association Scholarships,"Cultural, Community Engagement",17-18 years,12,Chinese Benevolent Association of Vancouver,"Vancouver, BC, Canada","Open to students of Chinese descent in British Columbia, demonstrating academic achievement and community service.",Recognizes academic achievements and community contributions of students of Chinese descent. Award amount varies by category.,http://www.cbaofbc.com/scholarship.html
Scholarship,Beedie Luminaries Scholarship,"General studies, Leadership, Community Service",17-19 years,12,Beedie Luminaries Foundation,"Vancouver, BC, Canada",Available to Grade 12 students in British Columbia facing financial adversity; Canadian citizens or permanent residents; students must enroll in post-secondary education at public institutions in BC.,"A scholarship program offering up to $44,000 per student for undergraduate programs, with support through mentorship, internships, and a connected alumni network. It aims to empower resilient students by addressing financial barriers.",https://beedieluminaries.ca/
Scholarship,Shad Valley Scholarships,STEM,15-18 years,10-12,Shad Canada,"Waterloo, ON, Canada",Open to high school students across Canada with an interest in STEM fields. Selection is based on academic performance and leadership potential.,"The Shad Valley program offers immersive STEM experiences, coupled with scholarships for high school students. Participants engage in collaborative projects and networking opportunities with industry professionals.",https://www.shad.ca/apply/
Award,Canadian Women in Technology Award,Technology,14-19,9-12,Canadian Women in Technology (CanWIT),Canada,Open to Canadian women excelling in technology sectors.,Recognizes achievements of women in technology. Encourages leadership and innovation.,https://www.canwit.ca/awards/
Award,TechGirls Canada Youth Award,Technology,14-19,9-12,TechGirls Canada,Canada,Encourages young women pursuing technology education or careers in Canada.,Promotes diversity and inclusion in technology fields. Encourages future tech leaders.,https://techgirls.ca/
Scholarship,BC School Sports Scholarships,Sports,14-19,9-12,BC School Sports,"Surrey, BC, Canada",Student-athletes in BC with achievements in academics and sports.,Scholarships for athletes pursuing higher education in BC. Based on academic and athletic excellence.,https://www.bcschoolsports.ca/awards/scholarships
Award,Premier’s Awards for Indigenous Youth Excellence in Sport,"Indigenous Youth, Sports",14-24 years,9-12,"Aboriginal Sport, Recreation and Physical Activity Partners Council","Victoria, BC, Canada","Indigenous youth residing in British Columbia, nominated for excellence in sports and community leadership.",Annual award recognizing Indigenous youth athletes for achievements in sports and leadership. Recipients are selected through regional and provincial nominations and are celebrated at the Gathering Our Voices conference.,https://www2.gov.bc.ca/gov/content/governments/indigenous-people/aboriginal-sport/premiers-awards
Scholarship,KidSport BC Scholarships,Sports,5-19,K-12,KidSport British Columbia,"Vancouver, BC, Canada","Children under 18 from low-income families in British Columbia, seeking to participate in organized sports.","Provides up to $400 per child per year to cover sport registration fees, promoting accessibility to organized sports. Applications are reviewed prior to the start of the season, and funding is provided directly to the sport organization.",https://kidsportcanada.ca/british-columbia/
Grant,NextGen Scholarship,General,16-19,10-12,P.E.R.K. Consulting,"Washington, D.C., USA","Open to international students or non-citizens attending college in Washington D.C., Maryland, or Virginia. Requires a minimum 3.0 GPA.","Offers a one-time award of $1,000. Applicants must submit essays, transcripts, and recommendation letters.",https://www.iefa.org/scholarships/2326/NextGen_Scholarship
Competition/Scholarship,Breakthrough Junior Challenge,"Science, Mathematics",13-18 years,8-12,Breakthrough Prize Foundation,"San Francisco, CA, USA",Open to students globally. Participants create videos explaining scientific concepts.,The Breakthrough Junior Challenge is an annual competition where students submit science/math videos. Winners receive scholarships and grants for their schools. Renewable participation each year.,https://breakthroughjuniorchallenge.org/
Scholarship,The Gates Scholarship,Leadership,17-19,12,The Bill & Melinda Gates Foundation,"Seattle, WA, USA","Open to U.S. citizens, nationals, or permanent residents. Applicants must be minority students from low-income households, Pell-eligible, and in good academic standing with a minimum GPA of 3.3.",The Gates Scholarship is a last-dollar scholarship that covers all educational costs not met by other aid. It targets high-potential minority students with demonstrated leadership abilities. Renewable throughout the college years with continued academic performance.,https://www.thegatesscholarship.org/scholarship
Free Educational Resource,3Blue1Brown,"Math, Physics",General audience,N/A,Grant Sanderson,USA,Global,"3Blue1Brown offers visually intuitive math and physics lessons, making abstract topics more accessible through engaging animations and videos.",https://www.3blue1brown.com/
Free Educational Resource,3Blue1Brown,"Math, Visual Learning",General audience,N/A,Grant Sanderson,USA,Global,This version of 3Blue1Brown focuses on making complex mathematical concepts easier for general audiences with visual storytelling.,https://www.3blue1brown.com/
Free Educational Resource,3Blue1Brown,"Math, Technology",General audience,N/A,Grant Sanderson,USA,Global,"Covers higher-level math concepts along with applications in technology, including neural networks and AI.",https://www.3blue1brown.com/
Free Educational Resource,Art for Kids Hub,Art,5- 19,K-12,Art for Kids Hub,USA,Global,"A YouTube channel providing drawing tutorials aimed at children and families, promoting creativity with easy-to-follow lessons.",https://www.youtube.com/user/ArtforKidsHub
Courseware,Art of Problem Solving (AoPS),"Math, STEM, Problem Solving",Grades 6-12,6-12,AoPS,"San Diego, California, USA","Primarily open, but suited for advanced learners","AoPS focuses on problem-solving and high-level math, offering various courses, contests, and a supportive online community.",https://artofproblemsolving.com/
